{
  "schemaVersion": "1.0.0",
  "exportedAt": "2026-09-06T02:45:48Z",
  "favorites": ["case-532", "framework-001"],
  "collections": [
    {
      "name": "海报灵感",
      "items": [
        { "itemType": "template", "itemKey": "case-532" },
        { "itemType": "generation", "itemKey": "00000000-0000-4000-8000-000000000001" }
      ]
    }
  ],
  "history": [
    {
      "generationId": "00000000-0000-4000-8000-000000000001",
      "templateId": "case-532",
      "state": "succeeded",
      "createdAt": "2026-09-05T11:00:00Z"
    }
  ]
}
